{
  "id": "autonomous-agent-loop",
  "version": "1.0",
  "name": "Autonomous Agent Loop",
  "description": "Long-running autonomous planning or execution loop.",
  "providedBy": [
    "unsupported"
  ],
  "risk": {
    "level": "high",
    "requiresHumanReview": true,
    "notes": [
      "Out of scope for PersonaKit."
    ]
  },
  "notes": [
    "Included only so the example can explicitly forbid this capability."
  ]
}
